PERMITTED_VALUE	LONG_NAME	DEFINITION
Censored	Censored Data	Points of data for which only partial information is known.
No	No	The non-affirmative response to a question.
Not Allowed to Collect	Not Allowed To Collect	An indicator that specifies that a collection event was not permitted.
Not Applicable	Not applicable	Determination of a value is not relevant in the current context.
Not Reported	Not Reported	Not provided or available.
Unknown	Unknown	Not known, observed, recorded; or reported as unknown by the data contributor.
Yes	Yes	The affirmative response to a question.
