PERMITTED_VALUE	LONG_NAME	DEFINITION
Adjuvant	Adjuvant Therapy	(AD-joo-vant) Treatment given after the primary treatment to increase the chances of a cure. Adjuvant therapy may include chemotherapy, radiation therapy, hormone therapy, or biological therapy.
Curative	Curative treatment	A therapy designed to cure a condition.
Maintenance	Maintenance Therapy	Continuation of treatment for an extended period of time to prevent relapse.
Neoadjuvant	Neoadjuvant	Therapy administered prior to the primary treatment for the purpose of making the primary treatment more effective.
Palliative	Palliative therapy	The patient- and family-centered active holistic care of patients with advanced, progressive disease. Essential components of palliative care are: pain and symptom control, communication regarding treatment and alternatives, prognosis, and available services, rehabilitation services, care that addresses treatment and palliative concerns, intellectual, emotional, social, and spiritual needs, terminal care, support in bereavement. The goal of palliative care is an achievement of the best quality of life for patients and their families.
Prevention	Preventive Intervention	An attempt to prevent disease.
Unknown	Unknown	Not known, observed, recorded; or reported as unknown by the data contributor.
